{
  "schema_version": "0.1.0",
  "building_id": "03_disconnected_stair",
  "description": "Stair exists but the destination landing has no access relation.",
  "profiles": [
    {
      "profile_id": "ambulant",
      "min_width_m": 0.6,
      "clearance_m": 0.8,
      "can_use_stairs": true,
      "max_slope": 0.5
    },
    {
      "profile_id": "wheelchair",
      "min_width_m": 0.9,
      "clearance_m": 1,
      "can_use_stairs": false,
      "max_slope": 0.08333333333333333
    }
  ],
  "floors": [
    {
      "floor_id": "F0",
      "elevation_m": 0,
      "boundary": [
        [
          0,
          0
        ],
        [
          8,
          0
        ],
        [
          8,
          8
        ],
        [
          0,
          8
        ]
      ],
      "rooms": [
        {
          "room_id": "L0",
          "label": "L0",
          "polygon": [
            [
              0,
              0
            ],
            [
              4,
              0
            ],
            [
              4,
              8
            ],
            [
              0,
              8
            ]
          ]
        },
        {
          "room_id": "C0",
          "label": "C0",
          "polygon": [
            [
              4,
              0
            ],
            [
              8,
              0
            ],
            [
              8,
              8
            ],
            [
              4,
              8
            ]
          ]
        }
      ],
      "adjacency_edges": [
        [
          "L0",
          "C0"
        ]
      ],
      "access_edges": [
        {
          "edge_id": "E0",
          "connection_id": "D0",
          "permitted_profiles": [
            "ambulant",
            "wheelchair"
          ]
        }
      ],
      "obstacles": [],
      "reserved_portal_zones": [
        [
          [
            4,
            0
          ],
          [
            8,
            0
          ],
          [
            8,
            8
          ],
          [
            4,
            8
          ]
        ]
      ]
    },
    {
      "floor_id": "F1",
      "elevation_m": 3,
      "boundary": [
        [
          0,
          0
        ],
        [
          8,
          0
        ],
        [
          8,
          8
        ],
        [
          0,
          8
        ]
      ],
      "rooms": [
        {
          "room_id": "L1",
          "label": "L1",
          "polygon": [
            [
              0,
              0
            ],
            [
              4,
              0
            ],
            [
              4,
              8
            ],
            [
              0,
              8
            ]
          ]
        },
        {
          "room_id": "C1",
          "label": "C1",
          "polygon": [
            [
              4,
              0
            ],
            [
              8,
              0
            ],
            [
              8,
              8
            ],
            [
              4,
              8
            ]
          ]
        }
      ],
      "adjacency_edges": [
        [
          "L1",
          "C1"
        ]
      ],
      "access_edges": [],
      "obstacles": [],
      "reserved_portal_zones": [
        [
          [
            4,
            0
          ],
          [
            8,
            0
          ],
          [
            8,
            8
          ],
          [
            4,
            8
          ]
        ]
      ]
    }
  ],
  "connections": [
    {
      "connection_id": "D0",
      "evidence_id": "eD0",
      "u": "L0",
      "v": "C0",
      "kind": "door",
      "physical_profiles": [
        "ambulant",
        "wheelchair"
      ],
      "existing": true,
      "geometry": {
        "width_m": 1,
        "opening": [
          [
            4,
            1
          ],
          [
            4,
            2
          ]
        ],
        "landings": [
          {
            "room_id": "L0",
            "polygon": [
              [
                3,
                1
              ],
              [
                4,
                1
              ],
              [
                4,
                2
              ],
              [
                3,
                2
              ]
            ]
          },
          {
            "room_id": "C0",
            "polygon": [
              [
                4,
                1
              ],
              [
                5,
                1
              ],
              [
                5,
                2
              ],
              [
                4,
                2
              ]
            ]
          }
        ]
      }
    },
    {
      "connection_id": "D1",
      "evidence_id": "eD1",
      "u": "L1",
      "v": "C1",
      "kind": "door",
      "physical_profiles": [
        "ambulant",
        "wheelchair"
      ],
      "existing": true,
      "geometry": {
        "width_m": 1,
        "opening": [
          [
            4,
            1
          ],
          [
            4,
            2
          ]
        ],
        "landings": [
          {
            "room_id": "L1",
            "polygon": [
              [
                3,
                1
              ],
              [
                4,
                1
              ],
              [
                4,
                2
              ],
              [
                3,
                2
              ]
            ]
          },
          {
            "room_id": "C1",
            "polygon": [
              [
                4,
                1
              ],
              [
                5,
                1
              ],
              [
                5,
                2
              ],
              [
                4,
                2
              ]
            ]
          }
        ]
      }
    },
    {
      "connection_id": "W",
      "evidence_id": "eW",
      "u": "C0",
      "v": "C1",
      "kind": "stair",
      "physical_profiles": [
        "ambulant"
      ],
      "existing": true,
      "geometry": {
        "asset_id": "W",
        "width_m": 1,
        "rise_m": 3,
        "run_m": 6,
        "landings": [
          {
            "room_id": "C0",
            "polygon": [
              [
                5,
                1
              ],
              [
                6,
                1
              ],
              [
                6,
                2
              ],
              [
                5,
                2
              ]
            ]
          },
          {
            "room_id": "C1",
            "polygon": [
              [
                5,
                1
              ],
              [
                6,
                1
              ],
              [
                6,
                2
              ],
              [
                5,
                2
              ]
            ]
          }
        ],
        "footprints": [
          {
            "room_id": "C0",
            "polygon": [
              [
                5,
                1
              ],
              [
                7,
                1
              ],
              [
                7,
                7
              ],
              [
                5,
                7
              ]
            ]
          },
          {
            "room_id": "C1",
            "polygon": [
              [
                5,
                1
              ],
              [
                7,
                1
              ],
              [
                7,
                7
              ],
              [
                5,
                7
              ]
            ]
          }
        ]
      }
    }
  ],
  "portals": [
    {
      "portal_id": "PW",
      "kind": "stair",
      "transitions": [
        {
          "connection_id": "W",
          "permitted_profiles": [
            "ambulant"
          ]
        }
      ]
    }
  ],
  "obligations": [
    {
      "obligation_id": "O",
      "source": "L0",
      "target": "L1",
      "profile_id": "ambulant"
    }
  ],
  "actions": [
    {
      "action_id": "restore_landing_door",
      "type": "representation_correction",
      "cost": 1,
      "effects": [
        {
          "op": "activate_connection",
          "connection_id": "D1",
          "permitted_profiles": [
            "ambulant",
            "wheelchair"
          ]
        }
      ],
      "requires": [],
      "excludes": [],
      "evidence_ids": [
        "eD1"
      ]
    }
  ],
  "original_restoration_actions": []
}
