{
  "schema_version": "0.1.0",
  "building_id": "05_impossible_portal_footprint",
  "description": "Candidate footprint leaves the frozen endpoint room and floor.",
  "profiles": [
    {
      "profile_id": "ambulant",
      "min_width_m": 0.6,
      "clearance_m": 0.8,
      "can_use_stairs": true,
      "max_slope": 0.5
    },
    {
      "profile_id": "wheelchair",
      "min_width_m": 0.9,
      "clearance_m": 1,
      "can_use_stairs": false,
      "max_slope": 0.08333333333333333
    }
  ],
  "floors": [
    {
      "floor_id": "F0",
      "elevation_m": 0,
      "boundary": [
        [
          0,
          0
        ],
        [
          8,
          0
        ],
        [
          8,
          4
        ],
        [
          0,
          4
        ]
      ],
      "rooms": [
        {
          "room_id": "L0",
          "label": "L0",
          "polygon": [
            [
              0,
              0
            ],
            [
              4,
              0
            ],
            [
              4,
              4
            ],
            [
              0,
              4
            ]
          ]
        },
        {
          "room_id": "C0",
          "label": "C0",
          "polygon": [
            [
              4,
              0
            ],
            [
              8,
              0
            ],
            [
              8,
              4
            ],
            [
              4,
              4
            ]
          ]
        }
      ],
      "adjacency_edges": [
        [
          "L0",
          "C0"
        ]
      ],
      "access_edges": [
        {
          "edge_id": "E0",
          "connection_id": "D0",
          "permitted_profiles": [
            "ambulant",
            "wheelchair"
          ]
        }
      ],
      "obstacles": [],
      "reserved_portal_zones": [
        [
          [
            4,
            0
          ],
          [
            8,
            0
          ],
          [
            8,
            4
          ],
          [
            4,
            4
          ]
        ]
      ]
    },
    {
      "floor_id": "F1",
      "elevation_m": 3,
      "boundary": [
        [
          0,
          0
        ],
        [
          8,
          0
        ],
        [
          8,
          4
        ],
        [
          0,
          4
        ]
      ],
      "rooms": [
        {
          "room_id": "L1",
          "label": "L1",
          "polygon": [
            [
              0,
              0
            ],
            [
              4,
              0
            ],
            [
              4,
              4
            ],
            [
              0,
              4
            ]
          ]
        },
        {
          "room_id": "C1",
          "label": "C1",
          "polygon": [
            [
              4,
              0
            ],
            [
              8,
              0
            ],
            [
              8,
              4
            ],
            [
              4,
              4
            ]
          ]
        }
      ],
      "adjacency_edges": [
        [
          "L1",
          "C1"
        ]
      ],
      "access_edges": [
        {
          "edge_id": "E1",
          "connection_id": "D1",
          "permitted_profiles": [
            "ambulant",
            "wheelchair"
          ]
        }
      ],
      "obstacles": [],
      "reserved_portal_zones": [
        [
          [
            4,
            0
          ],
          [
            8,
            0
          ],
          [
            8,
            4
          ],
          [
            4,
            4
          ]
        ]
      ]
    }
  ],
  "connections": [
    {
      "connection_id": "D0",
      "evidence_id": "eD0",
      "u": "L0",
      "v": "C0",
      "kind": "door",
      "physical_profiles": [
        "ambulant",
        "wheelchair"
      ],
      "existing": true,
      "geometry": {
        "width_m": 1,
        "opening": [
          [
            4,
            1
          ],
          [
            4,
            2
          ]
        ],
        "landings": [
          {
            "room_id": "L0",
            "polygon": [
              [
                3,
                1
              ],
              [
                4,
                1
              ],
              [
                4,
                2
              ],
              [
                3,
                2
              ]
            ]
          },
          {
            "room_id": "C0",
            "polygon": [
              [
                4,
                1
              ],
              [
                5,
                1
              ],
              [
                5,
                2
              ],
              [
                4,
                2
              ]
            ]
          }
        ]
      }
    },
    {
      "connection_id": "D1",
      "evidence_id": "eD1",
      "u": "L1",
      "v": "C1",
      "kind": "door",
      "physical_profiles": [
        "ambulant",
        "wheelchair"
      ],
      "existing": true,
      "geometry": {
        "width_m": 1,
        "opening": [
          [
            4,
            1
          ],
          [
            4,
            2
          ]
        ],
        "landings": [
          {
            "room_id": "L1",
            "polygon": [
              [
                3,
                1
              ],
              [
                4,
                1
              ],
              [
                4,
                2
              ],
              [
                3,
                2
              ]
            ]
          },
          {
            "room_id": "C1",
            "polygon": [
              [
                4,
                1
              ],
              [
                5,
                1
              ],
              [
                5,
                2
              ],
              [
                4,
                2
              ]
            ]
          }
        ]
      }
    },
    {
      "connection_id": "W",
      "evidence_id": "eW",
      "u": "C0",
      "v": "C1",
      "kind": "lift",
      "physical_profiles": [
        "ambulant",
        "wheelchair"
      ],
      "existing": false,
      "geometry": {
        "asset_id": "W",
        "width_m": 1,
        "rise_m": 3,
        "run_m": 6,
        "landings": [
          {
            "room_id": "C0",
            "polygon": [
              [
                8.5,
                1
              ],
              [
                9.5,
                1
              ],
              [
                9.5,
                2
              ],
              [
                8.5,
                2
              ]
            ]
          },
          {
            "room_id": "C1",
            "polygon": [
              [
                8.5,
                1
              ],
              [
                9.5,
                1
              ],
              [
                9.5,
                2
              ],
              [
                8.5,
                2
              ]
            ]
          }
        ],
        "footprints": [
          {
            "room_id": "C0",
            "polygon": [
              [
                8.5,
                1
              ],
              [
                10.5,
                1
              ],
              [
                10.5,
                3
              ],
              [
                8.5,
                3
              ]
            ]
          },
          {
            "room_id": "C1",
            "polygon": [
              [
                8.5,
                1
              ],
              [
                10.5,
                1
              ],
              [
                10.5,
                3
              ],
              [
                8.5,
                3
              ]
            ]
          }
        ]
      }
    }
  ],
  "portals": [],
  "obligations": [
    {
      "obligation_id": "O",
      "source": "L0",
      "target": "L1",
      "profile_id": "wheelchair"
    }
  ],
  "actions": [
    {
      "action_id": "impossible_lift",
      "type": "physical_intervention",
      "cost": 1,
      "effects": [
        {
          "op": "activate_connection",
          "connection_id": "W",
          "permitted_profiles": [
            "ambulant",
            "wheelchair"
          ]
        }
      ],
      "requires": [],
      "excludes": [],
      "evidence_ids": [
        "eW"
      ],
      "geometry_certificate": {
        "geometry_model": "reserved_interfaces_2d_v1",
        "connection_ids": [
          "W"
        ],
        "changed_floor_ids": []
      }
    }
  ],
  "original_restoration_actions": []
}
